{
  "schemaVersion": 1,
  "repository": "Xpotato1024/xpotato-site",
  "tag": "legacy-pre-vnext-2026-08-28",
  "tagObjectSha": "8503f5a50a5fb3d27a02422da0b50dc66c818b02",
  "commitSha": "927d105713561309fc5e2374396f86646b5aeb2a",
  "generatorVersion": "1.0.0",
  "hashRuleVersion": "legacy-source-bytes-v1",
  "inventoryPayloadSha256": "9151be197d9e48a12297d45dfdd2a72a15cf9ce16f143fdc16b60e5345d37493",
  "publishedContentCounts": {
    "blog": 44,
    "projects": 6,
    "notes": 1,
    "tools": 1,
    "pages": 1
  },
  "totalContentCounts": {
    "blog": 44,
    "projects": 6,
    "notes": 1,
    "tools": 1,
    "pages": 1
  },
  "totalContentCount": 53,
  "routeCount": 72,
  "wordpressQueryIdentityCount": 3,
  "gitMediaCount": 16,
  "gitMediaBytes": 4559586,
  "taxonomyRecordCount": 100,
  "interactiveRecordCount": 1,
  "legacyHtmlRecordCount": 2,
  "unresolvedMediaReferenceCount": 2,
  "designTimeBaseline": {
    "publishedContentCounts": {
      "blog": 44,
      "projects": 6,
      "notes": 1,
      "tools": 1,
      "pages": 1
    },
    "gitMediaBytes": 4559586,
    "wordpressQueryIdentityCount": 3,
    "interactiveRecordCount": 1
  },
  "legacyBuild": {
    "status": "FAIL",
    "nodeVersion": "v24.19.0",
    "npmVersion": "11.19.0",
    "packageLockBlobSha": "bb805f8a5558bf1eebe6d57d8292f7f69cb06d5a",
    "distManifestSha256": null,
    "endpointPathsSha256": "3bdb9ced87a60ee4bb9d52c680b274ba1ed8438e813fd7d0c09ee5e39879fd92",
    "fileCount": 90,
    "repeatedBuild": false,
    "observedDistManifestSha256": [
      "570f9ae9419136c5ae47ea49e0000d43b20df44e86bbd41d010bea1680d928f6",
      "235c3fe4083645eb65990a15d7c38e05579d67fde4346daedbf7d5f73cad7358"
    ],
    "differingArtifactCount": 30,
    "failureCode": "NONDETERMINISTIC_OUTPUT"
  }
}
